{
  "schema_version": "drift-evidence.v1",
  "evidence_id": "demo-drift-001",
  "model_version": "classifier-demo-2026-09-21-001",
  "detector_version": "demo-detector.v1",
  "metric_name": "topic_distribution_js_divergence",
  "baseline_window_start": "2026-09-01T00:00:00Z",
  "baseline_window_end": "2026-09-08T00:00:00Z",
  "observed_window_start": "2026-09-08T00:00:00Z",
  "observed_window_end": "2026-09-15T00:00:00Z",
  "baseline_value": 0.04,
  "observed_value": 0.12,
  "drift_score": 0.08,
  "threshold": 0.05,
  "sample_count": 180,
  "minimum_sample_count": 100,
  "synthetic": true
}
